ScreenName,Text,text
MohannaAlhubail,"إن المناضلين الصادقين في المؤسسات الطبية بكل أذرعها المثابرون بحق في رسالتهم
هم اليوم حملة الرحمة الوجودية التي فطرها الله بين البشر
فتحية إجلال لهم والرحمة لشهدائهم
واللعنة على من صنع قاعدة هذا التوحش الرأسمالي في العالم التي خلقت أرضية تمكن الفيروس وأسقطت حقوق العالم الإنساني",ان المناضلين الصادقين في الموسسات الطبية بكل اذرعها المثابرون بحق في رسالتهم هم اليوم حملة الرحمة الوجودية التي فطرها الله بين البشر فتحية اجلال لهم والرحمة لشهدايهم واللعنة على من صنع قاعدة هذا التوحش الراسمالي في العالم التي خلقت ارضية تمكن الفيروس واسقطت حقوق العالم الانساني
Alsharqinfo,"ميزة الدولة،أنها تخاطب التيارات،بخطاب المواطنة لا الجماعة،وهذا يساعدها على استقطاب الجميع،وأياً كانت التيارات،الإسلامية والعلمانية والقبلية،فان لهم مشروعاً ناجحاوحيدايجمعهم،وهو الدولة الصومالية القوية بكرامة افرادها ونهضتها الوطنية
#الصومال
أ.مهنا الحبيل
https://t.co/8yWtSpIMRy https://t.co/kHULsK9TAy",ميزة الدولةانها تخاطب التياراتبخطاب المواطنة لا الجماعةوهذا يساعدها على استقطاب الجميعوايا كانت التياراتالاسلامية والعلمانية والقبليةفان لهم مشروعا ناجحاوحيدايجمعهموهو الدولة الصومالية القوية بكرامة افرادها ونهضتها الوطنية امهنا الحبيل
moh1979yahia,"RT @aalodah: جزء من القصة هنا.. 

#سلمان_العودة https://t.co/MP6G2Gz3Sw",جزء من القصة هنا
DAWN_Arabic,"عبد الله العودة: انتهى حصار #قطر ووالدي الذي دعا للمصالحة لم يخرج من السجن
#السعودية 
@aalodah 
https://t.co/XFv29mhFkK",عبد الله العودة انتهى حصار ووالدي الذي دعا للمصالحة لم يخرج من السجن
alkhaleja,"يقود الحزب الناشط الحقوقي، يحيى عسيري، ومن أعضائه الأكاديمية مضاوي الرشيد، الباحث سعيد بن ناصر الغامدي، وعبد الله العودة المقيم في الولايات المتحدة، وعمر بن عبد العزيز المقيم في كندا
@The_NAAS @aalodah @MadawiDr @oamaz7 @abo1fares @saiedibnnasser 
تفاصيل:https://t.co/GP9j9NKTgZ",يقود الحزب الناشط الحقوقي يحيى عسيري ومن اعضايه الاكاديمية مضاوي الرشيد الباحث سعيد بن ناصر الغامدي وعبد الله العودة المقيم في الولايات المتحدة وعمر بن عبد العزيز المقيم في كندا تفاصيل
MohannaAlhubail,النور ..البياض.. الخُضرة ..النهر والبحر.. الشمس المشرقة ...الأرض المبتهجة .. دلائل الله إليك تقدم في مهمة الاستخلاف من جديد فالحياة للتجديد,النور البياض الخضرة النهر والبحر الشمس المشرقة الارض المبتهجة دلايل الله اليك تقدم في مهمة الاستخلاف من جديد فالحياة للتجديد
Jasminkoratela1,"@aalodah @salman_alodah لا حول ولا قوة إلا بالله العلي نستغفرك من كل ذنب عظيم فإنه لا يغفر الذنوب إلا أنت وحدك لا شريك لك الله أكبر ولله الحمد وهو على كل شيء قدير اللهم آمين يارب العالمين والصلاة والسلام على رسول الله وعلى آله وصحبه أجمعين 
اللهم الفرج 
و الله المستعان",لا حول ولا قوة الا بالله العلي نستغفرك من كل ذنب عظيم فانه لا يغفر الذنوب الا انت وحدك لا شريك لك الله اكبر ولله الحمد وهو على كل شيء قدير اللهم امين يارب العالمين والصلاة والسلام على رسول الله وعلى اله وصحبه اجمعين اللهم الفرج و الله المستعان
F32551251,@aalodah الاخوان طلعوا في الهاشتاق هذا ولا استبعد انت واشكالك مسوينه,الاخوان طلعوا في الهاشتاق هذا ولا استبعد انت واشكالك مسوينه
Fh_Ghuwaydi,"من عجائب الأمور أن الصين تعلق رحلاتها الجوية مع بريطانيا بسبب شفافية الأخيرة في الإفصاح عن السلالات الجديدة من الوباء !!

ماذا لو لم تخفي الصين الحقيقة عن العالم في اواخر العام الماضي ؟!",من عجايب الامور ان الصين تعلق رحلاتها الجوية مع بريطانيا بسبب شفافية الاخيرة في الافصاح عن السلالات الجديدة من الوباء ماذا لو لم تخفي الصين الحقيقة عن العالم في اواخر العام الماضي
Dhifallah_f,@MohannaAlhubail الخبر غير صحيح الصحيح هو هروبهن من الجمعيه,الخبر غير صحيح الصحيح هو هروبهن من الجمعيه
HzClinic,"RT @aalodah: ""وَإِذْ قَتَلْتُمْ نَفْسًا فَادَّارَأْتُمْ فِيهَا ۖ وَاللَّهُ مُخْرِجٌ مَّا كُنتُمْ تَكْتُمُونَ (72)""",واذ قتلتم نفسا فاداراتم فيها والله مخرج ما كنتم تكتمون
nasser_2509,@aalodah @mshinqiti اللهم آمين,اللهم امين
Bila_L,@Alqudaimi سلمت يداك,سلمت يداك
Naardec17,"@MohannaAlhubail بالمناسبة لقد سمعت إن مذكرات عبدالحميد مزورة وأغلب ماورد فيها كذب ,و كارهي جمال الدين الأفغاني لايزالون إلى الآن يحتجون بها عليه!
ولا يقرأون مؤلفاته ويبحثوا في تراثه ليتعرفوا على عقله وفكره رحمة الله عليه.",بالمناسبة لقد سمعت ان مذكرات عبدالحميد مزورة واغلب ماورد فيها كذب كارهي جمال الدين الافغاني لايزالون الى الان يحتجون بها عليه ولا يقراون مولفاته ويبحثوا في تراثه ليتعرفوا على عقله وفكره رحمة الله عليه
MBAA,"مشاهدات نواف القديمي @Alqudaimi  لأحوال النازحين السوريين في #مخيم_الزعتري  
http://t.co/kQgF8Sjb",مشاهدات نواف القديمي لاحوال النازحين السورين في
HashimZamil,RT @aalodah: رحم الله #صالح_الشيحي الذي اعتقلتموه وحكمتم عليه ٥ سنوات سجن، ثم قضى نحبه بعيد الإفراج عنه في ظروف غامضة.. فقط لأنه قال بأن هن…,رحم الله الذي اعتقلتموه وحكمتم عليه سنوات سجن ثم قضى نحبه بعيد الافراج عنه في ظروف غامضة فقط لانه قال بان هن
Jasim436,"RT @MohannaAlhubail: المشهد الذي يختطه ثوار العراق في الفدائية وتفويج المشاعر الصادقة للعراق وطنية ترابه وعروبته وآمال حريته ونهضته
يبدو مس…",المشهد الذي يختطه ثوار العراق في الفدايية وتفويج المشاعر الصادقة للعراق وطنية ترابه وعروبته وامال حريته ونهضته يبدو مس
Alq_naser,حرة من حرائر #جزيرة_العرب  تقبع في سجون النظام السعودي منذ خمس سنوات دون ان ينصرها احد ولا ناصر لها الا الله،  تدخل في إضراب عن الطعام انصروا اعراضكم يا رجال الحمية #اضراب_المعتقله_امينه_الراشد,حرة من حراير تقبع في سجون النظام السعودي منذ خمس سنوات دون ان ينصرها احد ولا ناصر لها الا الله تدخل في اضراب عن الطعام انصروا اعراضكم يا رجال الحمية
clouds_136,"@MohannaAlhubail نعم...اتفق معك
بئس العبرة ف معصيتهم",نعماتفق معك بيس العبرة معصيتهم
WahbySha,"RT @aalodah: بينما تقتبسون الآن من كلامه حرفياً..
قبل ثلاث سنوات ونصف.. قالها ""لمافيه خير الشعوب""

سجنتموه.. حرمتم أطفاله ومنعتموهم من السف…",بينما تقتبسون الان من كلامه حرفيا قبل ثلاث سنوات ونصف قالها لمافيه خير الشعوب سجنتموه حرمتم اطفاله ومنعتموهم من السف
099mohammad990,RT @aalodah: الآن.. مشروع قانون معاقبة مبس في الكونغرس,الان مشروع قانون معاقبة مبس في الكونغرس
Tamem23228018,@MohannaAlhubail التعريص لاردوغان وتركيا وصل أزكم الانوف,التعريص لاردوغان وتركيا وصل ازكم الانوف
Alshamy44,"@MohannaAlhubail @mshinqitiما رأيناه إلى الآن أن الجميع مستعد لدعم الأسد علناوالذهاب بعيدا من أجل ذلك
إلا الرياض
ما زالت تزن موقفها بالميزان",رايناه الى الان ان الجميع مستعد لدعم الاسد علناوالذهاب بعيدا من اجل ذلك الا الرياض ما زالت تزن موقفها بالميزان
Dr_norahA,@MohannaAlhubail وأن من الخطير على أمن أي دولة أن تترك الساحة السياسية مفتوحة لمثلهم..,وان من الخطير على امن اي دولة ان تترك الساحة السياسية مفتوحة لمثلهم
aossa55,@MohannaAlhubail   والله تعبنا كل سنه المبنى يكون  اسواء من الي قبله معقوله مده الاجازه الطويله ولا سووا شي اتمنى احد يسمعنا والله تعبنا,والله تعبنا كل سنه المبنى يكون اسواء من الي قبله معقوله مده الاجازه الطويله ولا سووا شي اتمنى احد يسمعنا والله تعبنا
khalid_naser,@MohannaAlhubail أسلوبك يدل على نظرة استعلاء وغرور . . إذا كنت كذلك جامدا في أفكارك ولاتتغير فلايصح عليك لقب مفكر ولا حتى محلل,اسلوبك يدل على نظرة استعلاء وغرور اذا كنت كذلك جامدا في افكارك ولاتتغير فلايصح عليك لقب مفكر ولا حتى محلل
djihad4,@aalodah شكراً على التوضيح,شكرا على التوضيح
CS4g39zfBWNgXbL,"RT @MohannaAlhubail: #مهنا_الحبيل

مقال صحيفة الوطن 

نصيحة الشايب النجدي لولي العهد السعودي

#السعودية
#قطر #الأزمة_الخليجية 
https://t.co…",مقال صحيفة الوطن نصيحة الشايب النجدي لولي العهد السعودي
a_alemran,"قال الإمام الشافعي : (ليس لأحدٍ أبدًا أن يقول في شيء ""حلّ ولا حرُمَ"" إلا من جهة العلم، وجهةُ العلم: الخبرُ في الكتاب، أو السنة، أو الإجماع، أو القياس).

#الرسالة",قال الامام الشافعي ليس لاحد ابدا ان يقول في شيء حل ولا حرم الا من جهة العلم وجهة العلم الخبر في الكتاب او السنة او الاجماع او القياس
lehengissa,@MohannaAlhubail أخي الكريم مهنا الروس يريدونها مفاوضات لأجل المفاوضات لاﻷجل الوصول لحل سياسي وأظن أن عدوى المفاوضات الإيرانيةإنتقلت للروس,اخي الكريم مهنا الروس يريدونها مفاوضات لاجل المفاوضات لا جل الوصول لحل سياسي واظن ان عدوى المفاوضات الايرانيةانتقلت للروس
Wdets5cVykOv1ld,@aalodah @Benguennak سلمان العودة أكبرُ من السجن والسجَّان 🙏🏼 فك الله أسره,سلمان العودة اكبر من السجن والسجان فك الله اسره
turkysaleh,@Alqudaimi وهل كنت تتوقع أن يفوز غيره؟ تداول السلطة عملية صعبة وتحتاج لزمن حتى تترسخ عند المجتمعات النامية ، هذا إن صلحت النية,وهل كنت تتوقع ان يفوز غيره تداول السلطة عملية صعبة وتحتاج لزمن حتى تترسخ عند المجتمعات النامية هذا ان صلحت النية
abe1d,"RT @MohannaAlhubail: قولي لنا إن كان دمعك جارياَ
منذا يكفكف دمعنا يا شام

#سوريا
مسيرة ما بعد العشر تبعثعا روح الأطفال الكبار
اللهم نصرك وق…",قولي لنا ان كان دمعك جاريا منذا يكفكف دمعنا يا شام مسيرة ما بعد العشر تبعثعا روح الاطفال الكبار اللهم نصرك وق
deemokrs,@Alqudaimi القضاء قضاء الله وليس قضاء الانظمة,القضاء قضاء الله وليس قضاء الانظمة
HKA1964,"RT @aalodah: يبدو أن جهود كوادر الشعب المبدعة بدأت تقضّ مضاجع المستبدين..
لذلك حملات التلفيق والتشغيب والافتراء الشخصي ستبدأ..

وصراخ الذبا…",يبدو ان جهود كوادر الشعب المبدعة بدات تقض مضاجع المستبدين لذلك حملات التلفيق والتشغيب والافتراء الشخصي ستبدا وصراخ الذبا
OsamaSOmar,@MohannaAlhubail عالمنا اصبح أبلد لا إحساس  فيه ولا مباليا ما دام الضحايا هم الإسلاميون والهدف هو القضاء على الربيع العربي.,عالمنا اصبح ابلد لا احساس فيه ولا مباليا ما دام الضحايا هم الاسلاميون والهدف هو القضاء على الربيع العربي
ww55nn,@qahtani_s1 جزاك الله خير,جزاك الله خير
LemmouchiSalim,@aalodah اللهم فرج عليه و فك اسره,اللهم فرج عليه فك اسره
CzDSygvSEsavxe0,"RT @aalodah: #وطن_بلا_فساد يعني وطن لا استبداد.. وطن بلا ظلم ولا اعتقالات تعسفية.. وطن بدون قتل صحفيين في القنصليات..
بدون تعذيب للناشطات..…",يعني وطن لا استبداد وطن بلا ظلم ولا اعتقالات تعسفية وطن بدون قتل صحفين في القنصليات بدون تعذيب للناشطات
Dr_Mutlaq,شرح أذكار الصلاة https://t.co/WH3Kl8b2Pp,شرح اذكار الصلاة
ali_rkadi,@Alqudaimi   أين أنت وصحبُك من   #مليونية_المحدث_سليمان_العلوان,اين انت وصحبك من
reehalmatar0r0,@AbuAsim90 @MohannaAlhubailالخليجيون  لازالوا يلهثون وراء الحلم الامريكي ولو عاشوا لمشروعهم لانعشواعروشهم قبل ان تفرط فيهم شعوبهم,لازالوا يلهثون وراء الحلم الامريكي ولو عاشوا لمشروعهم لانعشواعروشهم قبل ان تفرط فيهم شعوبهم
QatarTarget,RT @aalodah: اليوم رفض استئناف الجزائية المتخصصة اعتراض الناشطة السعودية #لجين_الهذلول وأثبت الحكم الابتدائي الذي يشمل: ٥ سنوات و٨ أشهر مع…,اليوم رفض استيناف الجزايية المتخصصة اعتراض الناشطة السعودية واثبت الحكم الابتدايي الذي يشمل سنوات و 8 اشهر مع
Dahirow10,""" فك الله أسر الشيخ الدكتور #سلمان_العودة وفك الله أسر وكرب شقيقه الدكتور #خالد_العودة وفك الله أسر وكرب جميع المعتقلين في كل مكان يارب
#غدا_تطير_العصافير .

@aalodah https://t.co/ubkbh4qWlX",فك الله اسر الشيخ الدكتور وفك الله اسر وكرب شقيقه الدكتور وفك الله اسر وكرب جميع المعتقلين في كل مكان يارب
mao442,@Alqudaimi كله من الرز😊😊,كله من الرز
CANCONSULTANCY,يُلاحظ هنا أن مجمل هذه المسارات للمؤلف الهدّام، أو المؤلف الخطابي أو المؤلف المعارض أو المؤلف الطيّع، كلها لا تُغطّي ذلك الفراغ الكبير، الذي نعانيه في الشرق، ويعانيه العالم بسبب تخلي الشرق عن رسالته الفلسفية الفارقة.. https://t.co/Zori47dfEI,يلاحظ هنا ان مجمل هذه المسارات للمولف الهدام او المولف الخطابي او المولف المعارض او المولف الطيع كلها لا تغطي ذلك الفراغ الكبير الذي نعانيه في الشرق ويعانيه العالم بسبب تخلي الشرق عن رسالته الفلسفية الفارقة
ZHasnia,@aalodah خوفهم على كراسيهم لا يهمهم وطن و لا شعوب و إنما عروشهم حكام المصالح ☹️ #التطبيع_خيانة,خوفهم على كراسيهم لا يهمهم وطن لا شعوب انما عروشهم حكام المصالح
jnZ8ZcTG6ZpLUhH,"RT @aalodah: طغاة الاستبداد في مصر وفراعنة العالم الإسلامي قتلوا الدكتور #محمد_مرسي في سجون مصر.
إذا كان هذا تعاملهم مع رئيس مصري، فكيف يكو…",طغاة الاستبداد في مصر وفراعنة العالم الاسلامي قتلوا الدكتور في سجون مصر اذا كان هذا تعاملهم مع رييس مصري فكيف يكو
fikercenter,"من أبرز من ساهموا في التنظير الفكري والفلسفي ثم  السياسي والمجتمعي لليبراليَّة: جون لوك وجون ميل وجاك روسو ومونتسيكيو
#الليبرالية_السعودية",من ابرز من ساهموا في التنظير الفكري والفلسفي ثم السياسي والمجتمعي لليبرالية جون لوك وجون ميل وجاك روسو ومونتسيكيو
MohannaAlhubail,"عبد العزيز الحيص يفكك اللعبة الطائفية للنظام وحلفائه ويكشف ثورة سوريا الشعبية ..
صورة للجبناء وانصار الطائفية الايرانية
http://t.co/JQRkqtpn",عبد العزيز الحيص يفكك اللعبة الطايفية للنظام وحلفايه ويكشف ثورة سوريا الشعبية صورة للجبناء وانصار الطايفية الايرانية
sVAVfkBJh9epEUE,"RT @aalodah: اعملوا ريتويت لهذه التغريدة! 
#لاتقتلوا_سلمان_العودة",اعملوا ريتويت لهذه التغريدة
madyzsam,"@fikercenter
الأزمات والمشاكل حلها في كتاب الله وسنة رسوله صلى الله عليه وسلم
قال تعالى
إن الله لا يغير ما بقوم حتى يغيروا ما بأنفسهم",الازمات والمشاكل حلها في كتاب الله وسنة رسوله صلى الله عليه وسلم قال تعالى ان الله لا يغير ما بقوم حتى يغيروا ما بانفسهم
fikercenter,"لقد أربك الحسم الأمني خصوم حماس وأفشلهم خططهم بقدر ما وضع حماس أمام تحديات تعدى من إقالة حكومتها والحصار لحملات اجتثاثها في الضفة
#غزة_تنتصر",لقد اربك الحسم الامني خصوم حماس وافشلهم خططهم بقدر ما وضع حماس امام تحديات تعدى من اقالة حكومتها والحصار لحملات اجتثاثها في الضفة
sanusi90064,"@MohannaAlhubail
ربط الحاكم بالدولة والدولة بالحاكم
أليس أمر خطير؟!؛ وعند النظر إلى موقف الصديق (رض) بعد وفاة النبي ﷺ حيث قال:
من كان يعبد محمداً؛ فإن محمداً قد مات...
نظرة منه على خطورة ذلك؟!
الحاكم سيموت أو يسقط.. وهذا يعني انهيار الدولة بدونه؟!",ربط الحاكم بالدولة والدولة بالحاكم اليس امر خطير وعند النظر الى موقف الصديق رض بعد وفاة النبي حيث قال من كان يعبد محمدا فان محمدا قد مات نظرة منه على خطورة ذلك الحاكم سيموت او يسقط وهذا يعني انهيار الدولة بدونه
AohrUk_ar,"الشيخ سلمان العودة ومثله الكثير من المعتقلين يخضعون لمحاكمات هزلية توُزع الاتهامات فيها بصورة جزافية أمام قضاء مسيّس ينبثق من منظومة فاسدة ومتهالكة

البيان كاملًا : https://t.co/nL5Vh9Glw2

#أنقذوا_سلمان_العودة
#أفرجوا_عن_سلمان_العودة
 #العودة_يفقد_نصف_بصره

@aalodah https://t.co/zHfdPKjIzw",الشيخ سلمان العودة ومثله الكثير من المعتقلين يخضعون لمحاكمات هزلية توزع الاتهامات فيها بصورة جزافية امام قضاء مسيس ينبثق من منظومة فاسدة ومتهالكة البيان كاملا
GreenLord2,"RT @aalodah: اعملوا ريتويت لهذه التغريدة! 
#لاتقتلوا_سلمان_العودة",اعملوا ريتويت لهذه التغريدة
NAA_1980,"@aalodah اهل الشمال والجنوب والشرقيه والغربية والوسطى عندهم مقوله(مايردني الا سلمان)عندما كان اميراً للرياض تخيل هذا يقول على لسان الملك انه يقول لو كنت مسئولاً !!!
ياخي هذولا عالم دجاله وتعتاش على الدجل .
طبعا #فرخ_العوده المطالب بالحرية كما يدعي سيحضرني بعد هذي التغريدة😂 https://t.co/Y8iYR45EO8",اهل الشمال والجنوب والشرقيه والغربية والوسطى عندهم مقولهمايردني الا سلمانعندما كان اميرا للرياض تخيل هذا يقول على لسان الملك انه يقول لو كنت مسيولا ياخي هذولا عالم دجاله وتعتاش على الدجل طبعا المطالب بالحرية كما يدعي سيحضرني بعد هذي التغريدة
MohannaAlhubail,"طرح ياسين مفاهيم مهمة غابت عن الاسلاميين في التربية الروحية والنزاهة الذاتية والتجرد لحق لشعب لا التنظيم 
#الإمام_عبدالسلام_في_ذمة_السلام",طرح ياسين مفاهيم مهمة غابت عن الاسلامين في التربية الروحية والنزاهة الذاتية والتجرد لحق لشعب لا التنظيم
fikercenter,كان إعلان #تركيا مساندتها لعاصفة الحزم رسالة واضحة للقيادة #السعودية بأنها ترغب في بناء تحالف قوي لوقف التهديد الإيراني الذي وصفته بالمزعج,كان اعلان مساندتها لعاصفة الحزم رسالة واضحة للقيادة بانها ترغب في بناء تحالف قوي لوقف التهديد الايراني الذي وصفته بالمزعج
Dr_shaleh,@MohannaAlhubail والله يامهنا الحبيل شف من كان السبب في تشريد السوريين غير داعمي الثورات العربية وداعمي خراب الوطن العربي,والله يامهنا الحبيل شف من كان السبب في تشريد السورين غير داعمي الثورات العربية وداعمي خراب الوطن العربي
yusofhhd,"@aalodah الله الله 
لله دره و قد آل الى ما قال 
فرج الله عنه 
ما أفتك الشوق في اضلاع مغترب",الله الله لله دره قد ال الى ما قال فرج الله عنه ما افتك الشوق في اضلاع مغترب
fikercenter,"يدور اهتمام مراكز الأبحاث السياسية والاستراتيجية في#إيران في إطار دوائر ثلاث تمثل نقاط ارتكاز السياسة الرسمية ومناطق اهتمامها.. 
#طهران",يدور اهتمام مراكز الابحاث السياسية والاستراتيجية في في اطار دواير ثلاث تمثل نقاط ارتكاز السياسة الرسمية ومناطق اهتمامها
