ScreenName,Text,text
fikercenter,"في عام 2018 دخلت أمريكا على الخط كأكبر مصدر للنفط، ولا تزال تحتل المرتبة الأولى  ""13 مليون برميل يومياً"" ويعد #النفط_الصخري المتضرر الأول من أي انخفاض في أسعار النفط، نظراً لتكلفة استخراجه

https://t.co/8GEZ8zK49A
#النفط https://t.co/HOdDVrVA9n",في عام دخلت امريكا على الخط كاكبر مصدر للنفط ولا تزال تحتل المرتبة الاولى مليون برميل يوميا ويعد المتضرر الاول من اي انخفاض في اسعار النفط نظرا لتكلفة استخراجه
HamdyAFargAllah,@Alqudaimi مبروك علينا وعليكم وعلى الأمة الإسلامية جميعاً,مبروك علينا وعليكم وعلى الامة الاسلامية جميعا
aljohanyahmad11,RT @aalodah: أعلن للأمة العربية الإسلامية والعالم أن الوالد د. سلمان العودة يخضع لعملية قتل بطيء داخل السجن في الرياض، حيث التدهور المخيف ل…,اعلن للامة العربية الاسلامية والعالم ان الوالد سلمان العودة يخضع لعملية قتل بطيء داخل السجن في الرياض حيث التدهور المخيف
abouomarhajjar,RT @aalodah: #لاترحلوا_اسامة_الحسني لأن ترحيله يعني تعريضه لأبشع صنوف الأذى والتعذيب على يد طغمة فاسدة أثبتت خلال السنوات الماضية أنها مجمو…,لان ترحيله يعني تعريضه لابشع صنوف الاذى والتعذيب على يد طغمة فاسدة اثبتت خلال السنوات الماضية انها مجمو
Djabberr,@qahtani_s1 @ObaidDh انا متفهم انك ممكن تحط مانشت عشان يشدك للموضوع لكن مش بالسخافه دي، حرب بيولوجية ايه بس,انا متفهم انك ممكن تحط مانشت عشان يشدك للموضوع لكن مش بالسخافه دي حرب بيولوجية ايه بس
aammoona5,"انا خليجي مقيم بالرياض متزوج بفلسطينيه من مواليد الرياض قبل شهر واريد الطلاق لكن قلق على وضع اقامتها  هل من فكره لديكم
@MohannaAlhubail",انا خليجي مقيم بالرياض متزوج بفلسطينيه من مواليد الرياض قبل شهر واريد الطلاق لكن قلق على وضع اقامتها هل من فكره لديكم
MohannaAlhubail,"بعد حصيلة وعيك 
كن فاعلاً في رأيك
وثابتاً في مبدأك
لتساهم في مسيرة النهضة وأخلاقيات الفرد
هنا يرصف للمجتمع الرشيد",بعد حصيلة وعيك كن فاعلا في رايك وثابتا في مبداك لتساهم في مسيرة النهضة واخلاقيات الفرد هنا يرصف للمجتمع الرشيد
mbz4039,@MohannaAlhubail طلاسمك ذي صارت معروفه,طلاسمك ذي صارت معروفه
AMA75763816,@aalodah اقلها مؤبد بعد الي سواه ابوك دعوات الأمهات الي عيالهم ضاعوا في سوريا و العراق أوصلت,اقلها موبد بعد الي سواه ابوك دعوات الامهات الي عيالهم ضاعوا في سوريا العراق اوصلت
MohannaAlhubail,"حافظ الشيخ حمد على هذا التكثيف في وعيه وخدم في ذات الوقت ما يدعم اصول التدين لديه في موقعه اميناً للتوعية الاسلامية بوزارة المعارف
#ostathi",حافظ الشيخ حمد على هذا التكثيف في وعيه وخدم في ذات الوقت ما يدعم اصول التدين لديه في موقعه امينا للتوعية الاسلامية بوزارة المعارف
hmoyza,"@aalodah اهله الله عليكم باليمن والبركة و أقر الله اعيونكم بعودة شيخنا سلمان العودة
 الله يحفظه من كل مكروه.

اللهم ستودعناك عبدك سلمان# العودة اللهم ردة إلى أهله  معافا
وأهلك الظالمين في رمضان هذا يا رب",اهله الله عليكم باليمن والبركة اقر الله اعيونكم بعودة شيخنا سلمان العودة الله يحفظه من كل مكروه اللهم ستودعناك عبدك سلمان العودة اللهم ردة الى اهله معافا واهلك الظالمين في رمضان هذا يا رب
MohannaAlhubail,1-2دراسة مركز سترانوفر المخابراتي الامريكي عن الرياض والاخوان التي نشرتها مجلة العصر الابرز والاوضح في قلق واشنطن العميق من الاسلاميين .,دراسة مركز سترانوفر المخابراتي الامريكي عن الرياض والاخوان التي نشرتها مجلة العصر الابرز والاوضح في قلق واشنطن العميق من الاسلامين
MohannaAlhubail,الهيئة تدين الجرائم اللاأخلاقية والانتهاكات التي ترتكبها الأجهزة الحكومية ضد السجينات العراقيات http://t.co/T8d6Quq3,الهيية تدين الجرايم اللااخلاقية والانتهاكات التي ترتكبها الاجهزة الحكومية ضد السجينات العراقيات
elhamad_jawad,@MohannaAlhubail بالتاكيد هناك العقلاء والكبار الذين يعلمون ان انهاء الحكم الدكتاتوري متطلب مهم للنهضة،  لكن الكثيرين أساؤوا التقدير,بالتاكيد هناك العقلاء والكبار الذين يعلمون ان انهاء الحكم الدكتاتوري متطلب مهم للنهضة لكن الكثيرين اساووا التقدير
mohammed013013,RT @MajedAlasmariAP: كلام يستحق النظر بجدية 👇👇👇 https://t.co/9wXaU0uJXp,كلام يستحق النظر بجدية
fikercenter,"يرون المحافظون الجدد بأن من واجبهم التعجيل بعودة #المسيح إلى الأرض لتحقيق نبوءة الكتاب المقدس بشن #الحرب على المسلمين
http://t.co/QjBsV78Kct",يرون المحافظون الجدد بان من واجبهم التعجيل بعودة الى الارض لتحقيق نبوءة الكتاب المقدس بشن على المسلمين
sleman402,@MohannaAlhubail أي ايجابية ....   من خمس سنوات وماشفنا غير الدمار والقتل والتشريد,اي ايجابية من خمس سنوات وماشفنا غير الدمار والقتل والتشريد
Alsharqinfo,لم تتراجع حظوظ الالتزام الشرعي، في مشروع النهضة الماليزي، بل على العكس المساجد تزدحم وحلقات القرآن والدروس الشرعية تتزايد، والروح الاسلامية حاضرة بقوة والحجاب منتشر بقوة رغم انه غير مفروض من الدولة. https://t.co/6kTvwjDjQR,لم تتراجع حظوظ الالتزام الشرعي في مشروع النهضة الماليزي بل على العكس المساجد تزدحم وحلقات القران والدروس الشرعية تتزايد والروح الاسلامية حاضرة بقوة والحجاب منتشر بقوة رغم انه غير مفروض من الدولة
MohannaAlhubail,"@myv2014 
ليس كل قياداتهم بهذه الصورة ولعل الله يهديهم لإتقاء كوارث الفكر السطحي وسيبقى الأصل دور الجيش الحر في تواصله ونصحه لهم بحكمة الشام",ليس كل قياداتهم بهذه الصورة ولعل الله يهديهم لاتقاء كوارث الفكر السطحي وسيبقى الاصل دور الجيش الحر في تواصله ونصحه لهم بحكمة الشام
EntesarALBanna,"@MohannaAlhubail 
ونسبة الذين قتلوا من المصريين ١٠٠٪
هل تكذب الوحدة الوطنية ؟
#مواجهة_الإخوان_وتمرد #تمرد",ونسبة الذين قتلوا من المصرين هل تكذب الوحدة الوطنية
almidan,"RT @aalodah: كانت من المقولات الجاهلية الظالمة ""انصر أخاك ظالماً أو مظلوماً"" فجاء الإسلام ليقول بأن نُصرة ""أخيك"" الظالم (أو المواطن).. تكون…",كانت من المقولات الجاهلية الظالمة انصر اخاك ظالما او مظلوما فجاء الاسلام ليقول بان نصرة اخيك الظالم او المواطن تكون
SaqrHajr,@MohannaAlhubail طبعا كالعادة تبرئون القاعدة من الذنب,طبعا كالعادة تبريون القاعدة من الذنب
alsuhyannabeel,"@MohannaAlhubail 

 تمجد الغزاة البرتغاليين والفرس 

وتلمز من قاوم الغزاة وحاربهم 
. http://t.co/aQpcV3vH3p",تمجد الغزاة البرتغالين والفرس وتلمز من قاوم الغزاة وحاربهم
DH_1444,@qahtani_s1 شيخ المجاهدين : عمر المحتار -رحمه الله-,شيخ المجاهدين عمر المحتار رحمه الله
ZHasnia,"@aalodah فك الله أسره ويخرج سالماً غانما معافى وجميع المسلمين يارب العالمين 🤲
إنشاء الله ترجع هذه الأيام بخير 🌹⁦♥️⁩",فك الله اسره ويخرج سالما غانما معافى وجميع المسلمين يارب العالمين انشاء الله ترجع هذه الايام بخير
kaledmohd11,@Alqudaimi خذ الحذر,خذ الحذر
MohannaAlhubail,@tahaalhajji واجب,واجب
LinaKIrsheid,@MohannaAlhubail هل سينشغلوا بانفسهم ويريحونا؟,هل سينشغلوا بانفسهم ويريحونا
MohannaAlhubail,"رثاء شاعر #الأحساء الخال احمد بن الشيخ راشد المبارك رحمه الله
في القائد الشهيد بطل المقاومة في #فلسطين #عبد_القادر_الحسيني تقبله الله في عليين
مع ترجمة ضافية جميلة للشهيد قدمها أ. مشاري بن فهد المنصور
أنصح الجميع باستكمال التيوب القصير 
https://t.co/t5BuzWS67e",رثاء شاعر الخال احمد بن الشيخ راشد المبارك رحمه الله في القايد الشهيد بطل المقاومة في تقبله الله في علين مع ترجمة ضافية جميلة للشهيد قدمها مشاري بن فهد المنصور انصح الجميع باستكمال التيوب القصير
reama1,@MohannaAlhubail @France24_ar ولن يسموه أبدا، نحن ارتضينا هذه التسمية علينا من إعلامنا و مفكرينا، و هم لم يرتضوها حتى عند تطابق الجرائم.,ولن يسموه ابدا نحن ارتضينا هذه التسمية علينا من اعلامنا مفكرينا هم لم يرتضوها حتى عند تطابق الجرايم
fikercenter,"تمثل قضية #المهاجرين صداعاً مزمناً للحكومات الغربية اذ يمثل تدفق هذا العدد الضخم ازمة بالنسبة الى قطاع من المجتمع الغربي
#أوروبا",تمثل قضية صداعا مزمنا للحكومات الغربية اذ يمثل تدفق هذا العدد الضخم ازمة بالنسبة الى قطاع من المجتمع الغربي
AAalabdalqader,"@MohannaAlhubail 
شرف كبير لي أن تتابعني أستاذنا الكريم.",شرف كبير لي ان تتابعني استاذنا الكريم
almadarih,‏“‎@MohannaAlhubail‏: عاجل منبر ‏#رابعة_العدوية‏ ... http://t.co/IE2MKaj8Oj,عاجل منبر
Noura_H_ALsaud,"“@dreemmajd: @MohannaAlhubail 
#غرد_بصوره

لاتتخلى عن أمنياتك ، وتمسك بخيوط الأمل ، وسر على بركة الله .. http://t.co/dh6jB29Q”",لاتتخلى عن امنياتك وتمسك بخيوط الامل وسر على بركة الله
MohannaAlhubail,"وقعّت لدفترها فارتجفت
قالت مدادك أحمر؟
قلت نعم.. 
أنهكني الحب حتى جرى الدم في محابر روحي",وقعت لدفترها فارتجفت قالت مدادك احمر قلت نعم انهكني الحب حتى جرى الدم في محابر روحي
aalodah,"رحمه الله
كان مرسي الرئيس الوحيد المنتخب ديمقراطيا في تاريخ مصر الحديث",رحمه الله كان مرسي الرييس الوحيد المنتخب ديمقراطيا في تاريخ مصر الحديث
omaryoussuf10,@MohannaAlhubail للأسف فإني أراهم مازالوا بعيدين عن هذه الرؤية .,للاسف فاني اراهم مازالوا بعيدين عن هذه الروية
MajedAlasmariAP,"#حاسبوا_الفندق_الماجن 
بل حاسبوا ""ولي الأمر"" الماجن الذي لولاه ما رأينا المجاهرة بمظاهر الإنحراف والإحتفالات الماجنة ببلادنا وبمدينة رسول الله عليه الصلاة والسلام.",بل حاسبوا ولي الامر الماجن الذي لولاه ما راينا المجاهرة بمظاهر الانحراف والاحتفالات الماجنة ببلادنا وبمدينة رسول الله عليه الصلاة والسلام
sloon_97,"RT @qahtani_s1: 🔸📽 حلقة جديدة 

«صنم فرنسا 🇫🇷» || #إلا_رسول_الله

للمشاهدة:
https://t.co/IkGJDu0hcR https://t.co/NGTIuTrPwy",حلقة جديدة صنم فرنسا للمشاهدة
anyounis,"@MohannaAlhubail 
ياسيدي الفاضل
هذه مدرعة الجيش
وليست الشرطة
الجيش الذي اقسم انه لن يطلق الرصاص علي الشعب المصري",ياسيدي الفاضل هذه مدرعة الجيش وليست الشرطة الجيش الذي اقسم انه لن يطلق الرصاص علي الشعب المصري
fikercenter,"ان حملة الداعية المضادة للألمان في ذلك الزمن لا تختلف عن الدعاية ضد #الخطر الأصفر ""الصين"" أو الخطر الأخضر ""المسلمون""
""الصدمات الحضارية""",ان حملة الداعية المضادة للالمان في ذلك الزمن لا تختلف عن الدعاية ضد الاصفر الصين او الخطر الاخضر المسلمون الصدمات الحضارية
Amy64286461,@aalodah اللهمً فك اسره وقه شر الظالمين,اللهم فك اسره وقه شر الظالمين
NaqbiMuhanad,@4f9999 @badir148 @qahtani_s1 شكرا على تعليقك يا عبدالجمييل 😉😉😉😉😉😉😉😉😉😉😉😉,شكرا على تعليقك يا عبدالجميل
wewexxx86,@qahtani_s1 المفورض الفيه,المفورض الفيه
AthkarALshamiri,RT @aalodah: صباح هذا اليوم، حضر الوالد #سلمان_العودة جلسة سرّية ضمن المحاكمة الهزلية في المحكمة المتخصصة، وقد جيء به مقيّداً بالسلاسل مثل…,صباح هذا اليوم حضر الوالد جلسة سرية ضمن المحاكمة الهزلية في المحكمة المتخصصة وقد جيء به مقيدا بالسلاسل مثل
MBKsure,RT @Alqudaimi: شتازي .. والنضال من أجل منع القضاء على “الذاكرة القمعية” وحماية “حق الناس بمعرفة ما جرى” .. https://t.co/4I8NQAsRSa,شتازي والنضال من اجل منع القضاء على الذاكرة القمعية وحماية حق الناس بمعرفة ما جرى
dakheelsuliman,@MohannaAlhubail والله يامهنا غلو وتطرف  أن الله اختاره ونعم بسلمان  لكن بحدود,والله يامهنا غلو وتطرف ان الله اختاره ونعم بسلمان لكن بحدود
_Majed1996,الله يفك أسرك يا والدنا,الله يفك اسرك يا والدنا
duweiry,"RT @MohannaAlhubail: كل من تحمل دماء #جمال_خاشقجي 
فليسدد حسابه، لكن إن كان للنظام السعودي شيء من المراجعة العقلية، فليعلم أن هذه الأطقم ال…",كل من تحمل دماء فليسدد حسابه لكن ان كان للنظام السعودي شيء من المراجعة العقلية فليعلم ان هذه الاطقم ال
Alqudaimi,@BadrAljaafari بالضبط :),بالضبط
Aggbbi,@MohannaAlhubail العفو أستاذنا الكبير,العفو استاذنا الكبير
fikercenter,"لا تزال المنطقة العربية منكوبة من جراء الصراعات الداخلية وهو ما يجعلها عرضة لتقطعات المصالح وتشابكها بشكل يمنع استقرارها

وما المحاولات الفرنسية المستميتة في دعم قوات #الاستبداد في #ليبيا، أو إملاء أوامرها #السياسية في #لبنان إلا دليل على ذلك 

https://t.co/a0mLN8CPyW https://t.co/THgUnqO3JZ",لا تزال المنطقة العربية منكوبة من جراء الصراعات الداخلية وهو ما يجعلها عرضة لتقطعات المصالح وتشابكها بشكل يمنع استقرارها وما المحاولات الفرنسية المستميتة في دعم قوات في او املاء اوامرها في الا دليل على ذلك
Marwahamzha,"RT @aalodah: المغدور #الشهيد_جمال_خاشقجي_رحمه_الله 
وحديث عن الحرية https://t.co/WJxiZBO6jc",المغدور وحديث عن الحرية
ghammsg,"@MohannaAlhubail 
استضاف سوق عكاظ جمعا منهم فدسموا تويتر ببقايا الطعام",استضاف سوق عكاظ جمعا منهم فدسموا تويتر ببقايا الطعام
MohannaAlhubail,"@rajablondon هذه مجرد خواطر لتأملات فكرية أخي العزيز
لم أطرحها لتقدم كمنهج للتفسير",هذه مجرد خواطر لتاملات فكرية اخي العزيز لم اطرحها لتقدم كمنهج للتفسير
fikercenter,لقد تبددت صورة #أمريكا راعية #الحرية و #الديمقراطية التي حرصت وفريق المحافظين على ترويجها بموازاة تهافت مقولة وجود اسلحة دمار شامل في العراق,لقد تبددت صورة راعية التي حرصت وفريق المحافظين على ترويجها بموازاة تهافت مقولة وجود اسلحة دمار شامل في العراق
mustafashrshr62,@aalodah اللهم اغفر له وارحمه,اللهم اغفر له وارحمه
c4JsZOdFx0gWMGA,"RT @aalodah: اعملوا ريتويت لهذه التغريدة! 
#لاتقتلوا_سلمان_العودة",اعملوا ريتويت لهذه التغريدة
MohannaAlhubail,"28- 
حصيلة ذلك كله خاصة مع وجود احد ائمة المالكية الوهابية من الاحسائيين وهو الامام والفقيه العظيم احمد بن مشرف 
#من_تاريخ_الاحساء4",حصيلة ذلك كله خاصة مع وجود احد ايمة المالكية الوهابية من الاحسايين وهو الامام والفقيه العظيم احمد بن مشرف
magnavimona,@MohannaAlhubail @mh_awadi كسر رقبتهم الكفرة الفجرة,كسر رقبتهم الكفرة الفجرة
Alqudaimi,"ما لنا غيرك يا الله..

#Syria",ما لنا غيرك يا الله
albrjali,"@MohannaAlhubail 
قال ﷺ :
من صلى عليّ واحدة صلى الله عليه بها عشر صلوات وحط عنه عشر خطيئات ورفع له عشر درجات

📚 رواه النسائي وصححه الألباني",قال من صلى علي واحدة صلى الله عليه بها عشر صلوات وحط عنه عشر خطييات ورفع له عشر درجات رواه النسايي وصححه الالباني
salahbabgi,@Alqudaimi القوى الثورية مهمتها دائما الضغط من اجل حالة مثالية  ولذلك كثير منهم ليس في وارد مشاركة سياسية أصلا ولن تجدي معه أي دبلماسية =,القوى الثورية مهمتها دايما الضغط من اجل حالة مثالية ولذلك كثير منهم ليس في وارد مشاركة سياسية اصلا ولن تجدي معه اي دبلماسية
Alsharqinfo,"ندوة مشتركة 2016 بغازي عنتاب 
عن التحول الديمقراطي والدولة المدنية
قدّم أ. #مهنا_الحبيل
ورقة بعنوان ..
الفكر المدني في الفقه الإسلامي
https://t.co/wqifozvCHr

_______________________
ملخص الأفكار في الورقة
تحرير  فريق التواصل الإجتماعي
#مكتب_دراسات_الشرق 

https://t.co/nYt2harS6P",ندوة مشتركة بغازي عنتاب عن التحول الديمقراطي والدولة المدنية قدم ورقة بعنوان الفكر المدني في الفقه الاسلامي ملخص الافكار في الورقة تحرير فريق التواصل الاجتماعي
MohannaAlhubail,"فالمقابل لحزب العدالة احزاب ذات ارث صراعي ايدلوجي وقومي شرس 
يفتح الباب لفوضى ثم عودة للجيش والعهد الدامي
 #من_ينتصر_في_انتخابات_تركيا",فالمقابل لحزب العدالة احزاب ذات ارث صراعي ايدلوجي وقومي شرس يفتح الباب لفوضى ثم عودة للجيش والعهد الدامي
hadik4,@MohannaAlhubail اسمها إدارة المركبات العسكرية ..وليست الجوية !,اسمها ادارة المركبات العسكرية وليست الجوية
fikercenter,"جمعت دولَ الخليج و #الولايات_المتحدة علاقة شراكة اقتضت أن تكون الاخيرة الداعم العسكري المدافع عن #الخليج ضد أي تهديد
https://t.co/kHOvX4VSKN",جمعت دول الخليج علاقة شراكة اقتضت ان تكون الاخيرة الداعم العسكري المدافع عن ضد اي تهديد
UBgO78mLWZFeS6u,"RT @aalodah: وردتني تسريبات حول خلفية التأجيل المتكرر في قضية الوالد وسبب تحديد جلسة بعد أربعة أشهر.
السبب.. هو أن الحكومة السعودية تجهّز م…",وردتني تسريبات حول خلفية التاجيل المتكرر في قضية الوالد وسبب تحديد جلسة بعد اربعة اشهر السبب هو ان الحكومة السعودية تجهز
MohannaAlhubail,@Hqorane آمين,امين
salbarghouthi,@MohannaAlhubail كلام جميل، عشنا أجمل سنين العمر في الأحساء وعرفنا الأصالة والشهامة في اهلها الله يحمي الحسا واهلها,كلام جميل عشنا اجمل سنين العمر في الاحساء وعرفنا الاصالة والشهامة في اهلها الله يحمي الحسا واهلها
Alqudaimi,٢- “دين الليبرالية” لسيسيل لابورد .. بترجمة عبيدة عامر .. https://t.co/WnLVvR6YHY,دين الليبرالية لسيسيل لابورد بترجمة عبيدة عامر
fikercenter,"ماهي الفرص الإيرانية على الصعيد العربي والدولي التي يمكن ان تسهل لها تنفيذ سياستها التوسعية ؟ 
https://t.co/Z37Gjuw3ul
 #ايران",ماهي الفرص الايرانية على الصعيد العربي والدولي التي يمكن ان تسهل لها تنفيذ سياستها التوسعية
MahmoudShbatat,RT @aalodah: تعديل إلهان عمر الذي يسمح بمعاقبة ولي العهد السعودي وأصوله الخاصة الآن تم الموافقة عليه في لجنة الشؤون الخارجية في مجلس النواب…,تعديل الهان عمر الذي يسمح بمعاقبة ولي العهد السعودي واصوله الخاصة الان تم الموافقة عليه في لجنة الشوون الخارجية في مجلس النواب
omar59,"@aalodah في نفس الدعوى القضائية التي إعتمدت على وثائقها بان السعودية دعمت الروس في سوريا هناك وثيقة تدعي بان #خاشقجي كان مصدراً لل F B I و يزودهم بمعلومات عن السعودية
ص٨٢ 
لا يمكن ان تكون الدعوى صادقة هناك و كاذبة هنا! https://t.co/umiDIPhmEP",في نفس الدعوى القضايية التي اعتمدت على وثايقها بان السعودية دعمت الروس في سوريا هناك وثيقة تدعي بان كان مصدرا لل يزودهم بمعلومات عن السعودية ص 82 لا يمكن ان تكون الدعوى صادقة هناك كاذبة هنا
