ScreenName,Text,text
sailm_now,@MohannaAlhubail  شفي الغليل .. يكون باللحظة إذا طال الزمن  بردت,شفي الغليل يكون باللحظة اذا طال الزمن بردت
AbuMohammed37,RT @aalodah: إذا صح اعتقال عبدالله العقيل.. فإن هذا يعني أن الذي أدار ملف خاشقجي وعملية قتله وملف عقوبات الإعدام وملف المعتقلات والمعتقلين…,اذا صح اعتقال عبدالله العقيل فان هذا يعني ان الذي ادار ملف خاشقجي وعملية قتله وملف عقوبات الاعدام وملف المعتقلات والمعتقلين
mshinqiti,"RT @aalodah: اشتمّ رائحة القميص وطالما...
هطل القميص على العيون وبشّرا..

*م. ع. https://t.co/VmZMDNMauB",اشتم رايحة القميص وطالما هطل القميص على العيون وبشرا م
_Figo272,RT @aalodah: إمام الحرم المعتقل الشيخ صالح آل طالب.. يتحدث عن مثل هذه الإيام العشر المباركة -فرّج الله عنه-. https://t.co/RoNAkci1eZ,امام الحرم المعتقل الشيخ صالح ال طالب يتحدث عن مثل هذه الايام العشر المباركة فرج الله عنه
haj_ibr,@MohannaAlhubail طيب أستاذ مهنا ما سر الزيارة الاخيرة لنتنياهو للاراضي العمانية؟ هل تندرج ضمن التجربة العمانية التي لا تعادي احدا؟ او ان الاستقبال جرى بضغط اقليمي؟ ما رايك؟,طيب استاذ مهنا ما سر الزيارة الاخيرة لنتنياهو للاراضي العمانية هل تندرج ضمن التجربة العمانية التي لا تعادي احدا او ان الاستقبال جرى بضغط اقليمي ما رايك
awx223344,RT @aalodah: للأسف الشديد تأكد لي الآن #اعتقال_الشيخ_ناصر_العمر من مكة المكرمة يوم الثلاثاء الماضي، لينضم إلى مجموعة المشايخ والعلماء والنا…,للاسف الشديد تاكد لي الان من مكة المكرمة يوم الثلاثاء الماضي لينضم الى مجموعة المشايخ والعلماء والنا
fikercenter,التكهن بالانتقال للحوار الفلسطيني مرهوناً بأداء حكومة رامي الحمد في #غزة وما سيترتب على ذلك من توافق مع #حماس حول تسليم الأجهزة الحكومية,التكهن بالانتقال للحوار الفلسطيني مرهونا باداء حكومة رامي الحمد في وما سيترتب على ذلك من توافق مع حول تسليم الاجهزة الحكومية
Boyacoub4,@FSAeqYTxVYhamGo @MohannaAlhubail @oamaz7 تعبير يثير الاشمئزاز والغثيان اضعاف اضعاف 😶,تعبير يثير الاشميزاز والغثيان اضعاف اضعاف
aalodah,@KhaledBinW آمين بارك الله فيك,امين بارك الله فيك
fikercenter,رصد الديبلوماسي الأمريكي كينكانون التصعيد بين شيعة #السعودية والحكومة عام 1979حين احتل #الشيعة الملهمين من الثورة الإيرانية شوارع #القطيف,رصد الديبلوماسي الامريكي كينكانون التصعيد بين شيعة والحكومة عام حين احتل الملهمين من الثورة الايرانية شوارع
mohamed80332181,@qahtani_s1 منتظرين بفارق الصبر شيخنا الفاضل.,منتظرين بفارق الصبر شيخنا الفاضل
AAlzahraani,@Alqudaimi الموت تحت سياط التعذيب بعد قليل على قناة الجزيرة الإخبارية وثائقي يتحدث عن قتيل غوانتاناموا ياسر الزهراني رحمه الله,الموت تحت سياط التعذيب بعد قليل على قناة الجزيرة الاخبارية وثايقي يتحدث عن قتيل غوانتاناموا ياسر الزهراني رحمه الله
Al_shaaheeen,@MohannaAlhubail لكن هل سبابة أبو بكر وعمر وعائشة كان سيدخلهم رسول الله صلى الله عليه وسلم ضمن ميثاق المواطنة #bahrain #gcc,لكن هل سبابة ابو بكر وعمر وعايشة كان سيدخلهم رسول الله صلى الله عليه وسلم ضمن ميثاق المواطنة
DR__TIGER,"@jihad_aljehani @Alqudaimi
ارجو افادتي باليوم والتاريخ والساعة
وسنقوم بمراجعة الملفات",ارجو افادتي باليوم والتاريخ والساعة وسنقوم بمراجعة الملفات
Wabil1200,"@MohannaAlhubail @OfvFi @slymanbbbb لو يعلم الناس  أن التصوف هو السعي للتحقق بمرتبة الإحسان وأنه ديدن أهل السنة على مر الزمان لما وصلنا إلى هذا الحال من الضعف والتشرذم والعصبية الجاهلية .
ولكن أين من يقرأ ؟!",لو يعلم الناس ان التصوف هو السعي للتحقق بمرتبة الاحسان وانه ديدن اهل السنة على مر الزمان لما وصلنا الى هذا الحال من الضعف والتشرذم والعصبية الجاهلية ولكن اين من يقرا
essamt74,تهنئة المسلم لغير المسلم بعيده هو من باب الواجب الاجتماعي لا الاعتقادي، هذه التفرقة مهمة في تناول الموضوع، وبسببها يقع الكثيرون في خطأ كبير.,تهنية المسلم لغير المسلم بعيده هو من باب الواجب الاجتماعي لا الاعتقادي هذه التفرقة مهمة في تناول الموضوع وبسببها يقع الكثيرون في خطا كبير
fikercenter,ستعمل ايران جاهدة على التحكم في حدود تطور العلاقات #السعودية العراقية، وتوظيفها لمصلحة أجندتها، وخاصة في المنطقة #الشرقية التي فيها #الشيعة,ستعمل ايران جاهدة على التحكم في حدود تطور العلاقات العراقية وتوظيفها لمصلحة اجندتها وخاصة في المنطقة التي فيها
MohannaAlhubail,"التخطيط الإقليمي والدولي والضغط الأخير على الجزيرة خاصة في الإعلام الإسرائيلي وأمارة ابوطبي يعلن عنه رسميا في قرار
 #إغلاق_الجزيرة_مصر",التخطيط الاقليمي والدولي والضغط الاخير على الجزيرة خاصة في الاعلام الاسراييلي وامارة ابوطبي يعلن عنه رسميا في قرار
Abdullah_f_ot,@aalodah @salman_alodah طيب تسدد ديني؟,طيب تسدد ديني
CANCONSULTANCY,"العلاقات الاجتماعية وأثرها الايجابي في تأمل الأفكار ودعمها..
كونوا على الموعد اليوم
والحلقة(11)
برنامج مع النبي
""حمزة والحياة الجديدة""
التاسعة م بتوقيت المدينة المنورة
#مهنا_الحبيل_مع_النبي https://t.co/L8NnnMlf7O",العلاقات الاجتماعية واثرها الايجابي في تامل الافكار ودعمها كونوا على الموعد اليوم والحلقة برنامج مع النبي حمزة والحياة الجديدة التاسعة بتوقيت المدينة المنورة
kwhammadi,@HazemGhamdi @Alqudaimi @abufajr @alabdulkarim0 جربوا هذه لابن زميع http://t.co/sg4U4yv9,جربوا هذه لابن زميع
20mtm,"@H__mu @MohannaAlhubail 
تاج محل معلم سياحي فاخر دخّل للدولة أضعاف تكاليف إنشائه...",تاج محل معلم سياحي فاخر دخل للدولة اضعاف تكاليف انشايه
B03000f,@MohannaAlhubail و هل تتوقع فوز المعارضه ! اردغان كاسحهم,هل تتوقع فوز المعارضه اردغان كاسحهم
MohannaAlhubail,"السلام عليكم 
صباح الخير 
الروح باقية في دنياها وفي أخراها 
احسن توجيهها 
بذكر ربها وأدبها مع مولاها ومع الناس 
من لا أدب له لا دين عنده",السلام عليكم صباح الخير الروح باقية في دنياها وفي اخراها احسن توجيfacewithtearsofjoyا بذكر ربها وادبها مع مولاها ومع الناس من لا ادب له لا دين عنده
DhuhaAlOraiman,RT @aalodah: أعلن للأمة العربية الإسلامية والعالم أن الوالد د. سلمان العودة يخضع لعملية قتل بطيء داخل السجن في الرياض، حيث التدهور المخيف ل…,اعلن للامة العربية الاسلامية والعالم ان الوالد سلمان العودة يخضع لعملية قتل بطيء داخل السجن في الرياض حيث التدهور المخيف
sama_smsm9,"RT @aalodah: شهادة السفير السعودي السابق في مصر.. حول الرئيس الشهيد #محمد_مرسي رحمه الله رحمة واسعة 
 https://t.co/qZjQ8H43uD",شهادة السفير السعودي السابق في مصر حول الرييس الشهيد رحمه الله رحمة واسعة
afj506,@MohannaAlhubail  الله يستر عليه,الله يستر عليه
saeedmadad,"@MohannaAlhubail @Drbakkar 
من المضحك حقا الفرح بهذا الخبر!!!!!!!",من المضحك حقا الفرح بهذا الخبر
SALEH62330180,@aalodah اللهم فك اسره  وانصره على من ظلمه .,اللهم فك اسره وانصره على من ظلمه
ALANSARI1954,"@MohannaAlhubail 
ولا يستقيم كذلك مع ما يتحدثون عنه من الوحدة والمواطَنَة الخليجية الواحدة",ولا يستقيم كذلك مع ما يتحدثون عنه من الوحدة والمواطنة الخليجية الواحدة
t_alahmad,"@Alqudaimi 
السلام عليكم ورحمة الله وبركاته
أخي الكريم نواف القديمي
أرسلت لك رسالة قبل فترة
أسأل عن الجزءالثاني
من مقال عن داعس
ما وصلني رد",السلام عليكم ورحمة الله وبركاته اخي الكريم نواف القديمي ارسلت لك رسالة قبل فترة اسال عن الجزءالثاني من مقال عن داعس ما وصلني رد
fikercenter,"وبالعموم، فقد ارتخت قبضة الكمالية منذ الدخول في التعددية،السياسية في #تركيا
""حزب العدالة والتنمية التركي.. دراسة في الفكرة والتجربة""",وبالعموم فقد ارتخت قبضة الكمالية منذ الدخول في التعدديةالسياسية في حزب العدالة والتنمية التركي دراسة في الفكرة والتجربة
hamdan_halima,@MohannaAlhubail @yahyahawwa اللهم دمرهم تدميرا كل من شارك في هذه السخافه,اللهم دمرهم تدميرا كل من شارك في هذه السخافه
hammadalshortan,RT @qahtani_s1: موجز تاريخ التوسع الاستيطاني الصهيوني في أرض فلسطين المباركة. https://t.co/oRPpoFmU2A,موجز تاريخ التوسع الاستيطاني الصهيوني في ارض فلسطين المباركة
fikercenter,"#تقدير_موقف:
"" العلاقات #السعودية التركية.. الواقع والمستقبل""
متاح للتحميل:
http://t.co/hN8dIo4qRV
#تركيا
#السعودية http://t.co/UdKcNGG9J9",العلاقات التركية الواقع والمستقبل متاح للتحميل
kaseb9969,"@aalodah @SaudiEmbassyUSA @tahaalhajji @oamaz7 @abo1fares @Hala_Aldosari @alia_ww @ashmlan @MadawiDr @AreejASadhan @SaharAlFaifi زقاً ولد زقاً وجدك بعد زق

الله يكرم من يقرأ",زقا ولد زقا وجدك بعد زق الله يكرم من يقرا
mahmoedalsoso,@MohannaAlhubail مستمرين في الحياة متمتعين بها و نعمل لنحفر اسامينا في التاريخ رغما عن ابن اليهودية سنظل نصنع التاريخ ونعلمه لأطفالنا #غزة,مستمرين في الحياة متمتعين بها نعمل لنحفر اسامينا في التاريخ رغما عن ابن اليهودية سنظل نصنع التاريخ ونعلمه لاطفالنا
malmatarq8,"4- وهذا سبب عدم الاستعجال عند المحور الغربي في إقرار سياسات شديده لاحتواء #كورونا صحيا ليس بسبب ضعف القدرة الطبية، ولكن خوفاً على تأثير سياسات التحوط الطبي على الاقتصاد نفسه.
#نبيها_صفر 
#حظر_تجول_اجباري_ينقذنا 
#الأزمة_المالية_العالمية_2020",وهذا سبب عدم الاستعجال عند المحور الغربي في اقرار سياسات شديده لاحتواء صحيا ليس بسبب ضعف القدرة الطبية ولكن خوفا على تاثير سياسات التحوط الطبي على الاقتصاد نفسه
9dmd,"فيديو #متداول 
#مقيم من الجنسية #المصرية
إستشعر أهمية القرارات الإحترازية في #المملكة 
ومسؤولية تنفيذها للوقاية من #فيروس_كورونا 
تقدم ببلاغ لجهات الإختصاص بعد رصد مخالفة لمحل حلاقة ..
مُطبّقاً لمقولة #كلنا_مسؤول https://t.co/1C0XyIqH8a",فيديو من الجنسية استشعر اهمية القرارات الاحترازية في ومسوولية تنفيذها للوقاية من تقدم ببلاغ لجهات الاختصاص بعد رصد مخالفة لمحل حلاقة مطبقا لمقولة
kaalghazi,@Alqudaimi وإذا جاءت الديموقراطية بخصومهم قالوا: لا حرية لأعداء الحرية.النكتة إن مقال اليوم خرب اللعبة من الأساس وقال: لا نريد الديموقراطية!,واذا جاءت الديموقراطية بخصومهم قالوا لا حرية لاعداء الحريةالنكتة ان مقال اليوم خرب اللعبة من الاساس وقال لا نريد الديموقراطية
AlholohReem,"RT @aalodah: اليوم في جلسة محكمة للوالد الشيخ سلمان العودة، طلبت النيابة بالقتل تعزيراً له،
وقدمت ٣٧ تهمة أحدها إنشاؤه منظمة النصرة في الكو…",اليوم في جلسة محكمة للوالد الشيخ سلمان العودة طلبت النيابة بالقتل تعزيرا له وقدمت تهمة احدها انشاوه منظمة النصرة في الكو
hammad_1406,@Alsharqinfo @MohannaAlhubail الله على كمية الإبداع والكلمات المؤثرة التي تخرج من صميم القلب ❤️✋🏻,الله على كمية الابداع والكلمات الموثرة التي تخرج من صميم القلب
7rbYko,"@aalodah هذا الرخيص المفلس يتكلم عن سلمان العوده.
هزلت 

الجامي عبدالعزيز الريس الذي قال لو خرج (ولي الأمر) يزني ويشرب الخمر على الهواء. 

أحمد مطر.
يخاطب علماء السلطان 
قال لنا أعمى العميان تسعة أعشار الإيمان في طاعة أمر السلطان حتى لو صلى سكران حتى لو قتل الغلمان.",هذا الرخيص المفلس يتكلم عن سلمان العوده هزلت الجامي عبدالعزيز الريس الذي قال لو خرج ولي الامر يزني ويشرب الخمر على الهواء احمد مطر يخاطب علماء السلطان قال لنا اعمى العميان تسعة اعشار الايمان في طاعة امر السلطان حتى لو صلى سكران حتى لو قتل الغلمان
An0_ny_mous,"RT @aalodah: ""قد يكون بالفعل أمام المواطنين السعوديين طريق طويل في إنشاء حكومة ديمقراطية تمثل مصالحهم الحقيقية وتحترم حقوقهم، إلا أنه في ال…",قد يكون بالفعل امام المواطنين السعودين طريق طويل في انشاء حكومة ديمقراطية تمثل مصالحهم الحقيقية وتحترم حقوقهم الا انه في ال
aldaafass,"@Alqudaimi تتجه إن شاءالله إلى بر الأمان أخي نواف,فهؤلاء النسوة لم يتم القبض عليهن في منازلهن , وليست المراكز التجارية هي مكان المطالبات !",تتجه ان شاءالله الى بر الامان اخي نواففهولاء النسوة لم يتم القبض عليهن في منازلهن وليست المراكز التجارية هي مكان المطالبات
MohannaAlhubail,"هنا الأخ الغالي 
عبد الرحمن الخليفة الحملي 
يتوسط نجليه العريس الجميل 
عبد اللطيف على يساره 
وخليفة… http://t.co/PX2Ag6Vler",هنا الاخ الغالي عبد الرحمن الخليفة الحملي يتوسط نجليه العريس الجميل عبد اللطيف على يساره وخليفة
Mahmoud19776773,@aalodah اللهم اغفر له وارحمه برحمتك واسكنه الفردوس الاعلى,اللهم اغفر له وارحمه برحمتك واسكنه الفردوس الاعلى
Mr_Nourr,"@iAbuhesham @Alqudaimi 
المنطق هذا أشبه بتنابز النجوم الفنية فيما بينها
إذا ادعى واعترف المستبد بالديمقراطية فجميع الناس لها الحق في مراقبته",المنطق هذا اشبه بتنابز النجوم الفنية فيما بينها اذا ادعى واعترف المستبد بالديمقراطية فجميع الناس لها الحق في مراقبته
_M3rciless,@qahtani_s1 تستاهل,تستاهل
dfeqpH4Jj4p8C6u,RT @MohannaAlhubail: من نافلة القول، أنك من أهم الأقلام التي وقفت مع حرية الشعوب ودولة الحقوق والكرامة في الربيع العربي، يشهد لك كفاحك الصح…,من نافلة القول انك من اهم الاقلام التي وقفت مع حرية الشعوب ودولة الحقوق والكرامة في الربيع العربي يشهد لك كفاحك الصح
Alsharqinfo,"من مداخلة الشيخ سعيد الطنيجي-3- 
في مقهى روزنامة ثقافية في اسطنبول https://t.co/2WYxZLvih3",من مداخلة الشيخ سعيد الطنيجي في مقهى روزنامة ثقافية في اسطنبول
Alqudaimi,٤- الكتاب الثالث (نقد نظرية النسخ.. بحث في فقه مقاصد الشريعة.. http://t.co/HzI1gybF,الكتاب الثالث نقد نظرية النسخ بحث في فقه مقاصد الشريعة
firooz7,@MohannaAlhubail اعذرك استاذ مهنا لهذا الانحياز الواضح..حتى يستقر عملك لدى صحافتهم..لكنك في هذه التغريدة وما قبلها تجنيت واشعلت نارا تنهش الكويت المحبة للخير,اعذرك استاذ مهنا لهذا الانحياز الواضححتى يستقر عملك لدى صحافتهملكنك في هذه التغريدة وما قبلها تجنيت واشعلت نارا تنهش الكويت المحبة للخير
razzaq71,"@MohannaAlhubail @kowthermusa و له كتاب آخر رائع أنصح به و بقوة و هو الدين ضد الدين.
و شكرًا جزيلا و يومك أنت و كوثر سعيد إن شاء الله",له كتاب اخر رايع انصح به بقوة هو الدين ضد الدين و شكرا جزيلا يومك انت كوثر سعيد ان شاء الله
thenewkhaleej,"#الخليج_الجديد
مهنا الحبيل يكتب: #الخليج الجديد في السيناريوالغربي
http://t.co/pQZUzZThpI #الدولة_الإسلامية #الحوثيين http://t.co/jzSrs0GENK",مهنا الحبيل يكتب الجديد في السيناريوالغربي
Alsharqinfo,"""إلّا أن #تونس تعاني من ثنائية خطيرة، وهي أولوية الصراع عند بعض أحزابها وأفكارها، ترى إسقاط النهضة مقدم على استقرار تونس والتجربة الثورية ذاتها""
#جديد_المقالات
الباحث العربي المستقل
أ. مهنا الحبيل
صحيفة الوطن
https://t.co/AhnAGgQshe
#الغنوشي
وعلى فيسبوك...
https://t.co/AH8xr86xnF https://t.co/n1akQ02s2q",الا ان تعاني من ثنايية خطيرة وهي اولوية الصراع عند بعض احزابها وافكارها ترى اسقاط النهضة مقدم على استقرار تونس والتجربة الثورية ذاتها الباحث العربي المستقل ا مهنا الحبيل صحيفة الوطن وعلى فيسبوك
mareb_alward,موقع الصحوة نت اليمني ينشر مقال مهنا الحبيل http://t.co/NBUvL4KFY7 @MohannaAlhubail,موقع الصحوة نت اليمني ينشر مقال مهنا الحبيل
aralshamary,@MohannaAlhubail @AQalami لعن الله اليهود ومن عاونهم,لعن الله اليهود ومن عاونهم
ehabelsaid1,@MohannaAlhubail يعنى أيه تقديس التراث .. ؟,يعنى ايه تقديس التراث
BS2DEdu79kXYDtu,"@qahtani_s1 من و إلى مزبلة التاريخ...
من وإلى مجاري التاريخ...",من الى مزبلة التاريخ من والى مجاري التاريخ
kiiplk,"@MohannaAlhubail @JKhashoggi https://t.co/GGIXNLiqei
افضل تعليق سمعته عن قيادة المراءه👆🏻",افضل تعليق سمعته عن قيادة المراءه
fikercenter,"#أوراق_سياسية
قراءة في استراتيجيات حزب الله.. صراع الأيديولوجيات والتحالفات الإقليمية

""وحدة الدراسات والابحاث""
للاطلاع والتحميل:
https://t.co/mkIcV08n5j

#حزب_الله https://t.co/D37DQ81Aay",قراءة في استراتيجيات حزب الله صراع الايديولوجيات والتحالفات الاقليمية وحدة الدراسات والابحاث للاطلاع والتحميل
fikercenter,"في ذكرى #عاصفة_الحزم
حقائق عن سقوط #صنعاء بيد #المليشيات ودور المخلوع ""صالح"" في ذلك
https://t.co/beZBcDC3Xf  
#اليمن https://t.co/mmfd4KsIkJ",في ذكرى حقايق عن سقوط بيد ودور المخلوع صالح في ذلك
CANCONSULTANCY,"""هل الحوار المنطقي الحقوقي ينزع السلطة، أم يسعى لكي ينزع الظلم والتعسف من السُلطة، ويُنظّم مساراتها، ويفرز سلطاتها..؟""

#جديد_المقالات
صحيفة الوطن
الباحث العربي المستقل/أ. #مهنا_الحبيل يكتب:
هل الحوار أصلٌ أم استثناء؟ https://t.co/xQPO3k0PwP https://t.co/GjLdkP8br3",هل الحوار المنطقي الحقوقي ينزع السلطة ام يسعى لكي ينزع الظلم والتعسف من السلطة وينظم مساراتها ويفرز سلطاتها صحيفة الوطن الباحث العربي المستقلا يكتب هل الحوار اصل ام استثناء
falahaldosari,"@MohannaAlhubail 
كنا نظن أن حلب لن تثور لتأخرها لكن الآن هي من بإذن الله  سيحسم الثورة .",كنا نظن ان حلب لن تثور لتاخرها لكن الان هي من باذن الله سيحسم الثورة
MohannaAlhubail,قل يارب الخير ..لتُغادر مدارج الفشل ومقامع اليأس وأسوار الإحباط ومعوقات التقدم ..جاهدها واغتنم كل مسعى لمفارقتها ..تجد عنده حسن الرجعى,قل يارب الخير لتغادر مدارج الفشل ومقامع الياس واسوار الاحباط ومعوقات التقدم جاهدها واغتنم كل مسعى لمفارقتها تجد عنده حسن الرجعى
fikercenter,"من هم جماعة #الحوثي؟
وما أفكارهم ومعتقداتهم؟
وما مصادر القوة ونقاط ضعفهم؟
وهل هم بهذه القوة فعلاً !؟
http://t.co/LzHFgvCiAr
#اليمن
#السعودية",من هم جماعة وما افكارهم ومعتقداتهم وما مصادر القوة ونقاط ضعفهم وهل هم بهذه القوة فعلا
FerasAbuHelal,"الحمد لله على الحياة العادية.. حيث لا أطماع ولا طموحات كبرى.. ولا خيبات كبرى.. ولا اضطرار لتنازلات كبرى.
حياة صغيرة بدون صخب.. وبدون توقعات لا تصيب.",الحمد لله على الحياة العادية حيث لا اطماع ولا طموحات كبرى ولا خيبات كبرى ولا اضطرار لتنازلات كبرى حياة صغيرة بدون صخب وبدون توقعات لا تصيب
